PLACE NAME,LINK,TIME,NAME,EXPERIENCE,NUMBER OF REVIEW,REVIEW,STAR
Gudeg Yu Narni Tugu,,,,,,,
,https://www.google.com/maps/search/Gudeg Yu Narni Tugu jogja,,,,,,
,,,,,,,
,,TIME,NAME,EXPERIENCE,NUMBER OF REVIEW,REVIEW,STAR
,,4 bulan lalu,Rezkiawan Fadhilah,Local Guide,58 ulasan,"Sudah ada sejak tahun 1940, dahulu namanya Gudeg Bu Wito, sudah legendaris turun temurun. Warung pertama yang di sini. Sekarang sudah banyak cabangnya. Tipe gudeg yang kering. Ada gudeg kemasan juga yang bisa dibawa untuk oleh oleh dan expirednya 1 tahun. Harganya juga terjangkau Rp 15.000/porsi yang gudeg telur sejak review ini dibuat ya.",5
,,6 bulan lalu,Farhanpraw,Local Guide,212 ulasan,"Gudeg disini cukup lumayan banyak untuk sarapan, makan siang maupun makan malam dan enak untuk di santap.
-
Harga gudeg di bawah 45k dengan menu berada difoto

Tersedia paket yang bisa dibawa pulang atau makan di tempat untuk dibawah keluar kota bisa silahkan tanya pegawainya untuk ketahanan berapa hari

Ada pendamping kerupuk

Untuk minuman tersedia hanya air putih dan es/hangat teh manis/ tawar

Bisa makan ditempat dengan suasana seperti dirumah serta kebersihan alat dan tempat oke serta bisa dibawa pulang dengan kemasan yang kekinian atau dengan bakul
-
Pelayanan ramah dan cepat sangat rekomendasi untuk makan di sekitaran malioboro arah tugu agak selatan stasiun tugu Yogyakarta ( maaf kalo salah untuk pengarahan ) dimaps dekat hotel harper.",5
,,3 bulan lalu,lely liz,Local Guide,92 ulasan,Gudeg nya g manis... pas karo lidah suroboyo.,5
,,3 bulan lalu,Mufti Diorwta,Local Guide,217 ulasan,"Tempatnya kecil, seperti warung nasi pinggir jalan biasa

Rasa gudegnya manis, namun manisnya masih bisa ditoleransi oleh lidah saya daripada merk yang sebelah

Harganya cukup terjangkau bagi wisatawan, 15ribu sudah dapat nasi gudeg+krecek+telor

Tersedia paketan juga dengan kemasan besek
Jam bukanya pagi sekali

Saya beli paketan besek jam 6 pagi, sore masih bagus kualitasnya

Katanya cabangnya ada banyak, tapi ada yang beda menejemen",5
,,setahun lalu,Terryana Evi,Local Guide,93 ulasan,"Des 2022 makan di tempat ini. Uenak. Gudegnya terasa bgt. Ga asal. Ada menu langka ; bubur gudeg, nasinya di ganti bubur, gudeg dll nya bs ttp pilih sesuai selera. RM nya kecil, bersih, di gang tp deket dr jl raya, parkir di trotoar jl raya. Kl mau yg besar dg akses lbh baik bs k cabang yg lain. Harga standard, ga mahal",4
,,3 tahun lalu,Henry S,Local Guide,30 ulasan,"gudeg kering dengan rasa manis yang cocok untuk sarapan..

harga murah, porsi pas, rasa nikmat dan jam 5 pagi sudah buka (pas untuk sarapan setelah tiba di stasiun tugu)

bumbu tahunya luar biasa recomended dah

terdapat beragam pilihan minuman, untuk minum harganya hanya sedikit lebih mahal dari biasanya",5
,,4 tahun lalu,dennis,Local Guide,226 ulasan,Gudeg Yu Narni rasanya enak bagi kawan yang kangen dengan masakan lokal gudeg. Porsinya yang banyak serta tahu dan telurnya yang empuk membuat rasa kangen dengan gudeg ini terpenuhi. Sayang sekali tetapi ketika kita berkunjung sekitar jam 9 ayamnya masih baru datang.,4
,,5 tahun lalu,Rika Eridani,Local Guide,132 ulasan,Favorit sepanjang masa. Rasa Gudeg yang manisnya sedang dengan lauk pilihan berupa ayam/tahu/tempe/telur. Sambel Goreng Krecek dimasak kering dengan tempe dan kuah areh manis gurih.,5
,,3 tahun lalu,Khansa Firdausiafitriana,Local Guide,169 ulasan,"Rasa Gudeg nya Enak,Mantap,Rekomendasi deh utk yg mau cari gudeg..
Harga ny murahh bgtt..
Teh nya enak,gudeg nya nikmat..
Tersedia juga paketan utk buah tangan,tersedia besek,atau kendil..",5
,,4 bulan lalu,Hendra Fernansya,Local Guide,446 ulasan,"Gudeg dingin, tempat juga kurang rapi.",3
,,3 tahun lalu,Alnovisa Kartikasari,Local Guide,42 ulasan,"Kamu kalau ke jogya kemana? Ya ke gudek yu narni. Itu wajib hukumnya... pasti keluarga saya ke tempat ini.
Sampai pernah habis ada borongan. Qta kesana nasi kehabisan. Ya ibu saya maunya tungguin sampai nasi mateng.",5
,,setahun lalu,Aris Triyanto,Local Guide,129 ulasan,Gudeg jogja kaleng untuk bisa untuk oleh-oleh keluarga yang pengen coba gudeg jogja,5
,,2 tahun lalu,Amalia Ulinnuha,Local Guide,68 ulasan,"Rasanya enak, gudegnya manis dan lauk lainnya gurih hanya saja mungkin yg tidak terlalu suka gudeg kering akan seret saat makan karena porsinya juga cukup banyak.",4
,,setahun lalu,Eko Budi Santoso,Local Guide,35 ulasan,Rasanya enakkk. porsi nya pass buat sarapan pagi hari. kalo balik ke jogja bakal beli lagi,5
,,2 tahun lalu,Esti Dwi L,Local Guide,32 ulasan,"Pertama kali kesini, gudeng dg harga ramah dikantong, untuk rasa itu relatif ya. Sebelah2nya juga banyak yg jualan gudeg",3
,,setahun lalu,Fasa Aditya,Local Guide,110 ulasan,Gudegnya enak tidak kalah dibandingkan gudeg terkenal di jogja. Akan kembali lagi bila suatu saat ke jogja.,5
,,3 tahun lalu,Dian Aliviyanti,Local Guide,71 ulasan,"Gudeg terdekat dg hotel, harga standart, rasanya unt lidah jawa timuran sedikit berlebihan, tp ngangenin. Jadi pengen gudeg lagi.",4
,,4 tahun lalu,Exta Indra,Local Guide,644 ulasan,"Sejak SD sekitar tahun 1999 saya lengganan sering setiap Minggu pagi beli gudeg disini naik sepeda BMX. Jaman dulu yang jualin masih langsu Yu Narni nya sendiri. Dan kesini lagi sekarang seperti nostalgia pada jaman dulu.
Semoga kalau pas bertemu langsung tidak lupa. hehe.

Untuk gudegnya saya cocok rasanya.
Menu yang saya suka Nasi Gudeg Sayap.

Bagi yang mau
Sewa & Rental Koper Jogja
Instagram : @RentalKoperJogja",5
,,6 bulan lalu,Dodi Nurbadri,Local Guide,329 ulasan,berada di jalan strategis dekat tugu sajian khas uogya yang rasanya enak. harga worthed lah yaw..,4
,,4 bulan lalu,Bambang Eko Febrianto,Local Guide,148 ulasan,"Gudeg nya harga terjangkau, rasanyak maknyus apalagi krecek nya mantul",5
,,setahun lalu,Indri marsa,Local Guide,34 ulasan,"Tempatnya di dalam gang tapi tidak terlalu masuk. Pelayanan biasa saja, lauknya enak enak. Harganya standar",4
,,3 tahun lalu,Diana Az,Local Guide,373 ulasan,"Mengobati rasa penasaran dg gudeg, ini tidak terlalu manis, rasanya pas, harganya juga pas, tidak terlalu mahal, bisa jadi tujuan makan setelah jalan2 di sekitar tugu jogja, bukanya juga pagi sekali, suka makan disini, Kalo ke jogja lagi pengennya  makan gudeg di sini lagi",4
,,3 tahun lalu,Arianky Eldavi,Local Guide,41 ulasan,Enak tapi krecek masih kurang lembut hehe tempatnya mungkin bisa diperluas lagi soalnya selalu penuh,5
,,3 tahun lalu,Akino Archilles,Local Guide,33 ulasan,kreceknya agak alot.. rasanya tidak terlalu manis dan pas dilidah.. tapi bumbunya sedikit.. porsi nasinya byk tp gudegnya lumayan sedikit sih.. beda spt yg lainnya,4
,,5 tahun lalu,Lutfi Retno Wahyudyanti,Local Guide,444 ulasan,Makanan sejak jaman kecil. Gudeg keringnya enak. Suka minta tambah arehnya. Di jalan ini ada beberapa penjual gudeg. Yu Narni yang paling terkenal. Sekarang punya banyak cabang. Sayang porsinya kecil,5
